{
  "schema_version": 2,
  "profile": "full",
  "requested_runs": 3,
  "warmup_runs": 0,
  "environment": {
    "git_revision": "81f7ae59189273df6142307b73065d4a3ef875db",
    "git_dirty": false,
    "mojo_version": "Mojo 1.1.0 (8189361e)",
    "os": "Darwin",
    "architecture": "arm64"
  },
  "cases": [
    {
      "name": "typed localized execution",
      "command": "pixi run mojo run -I src benchmarks/localized_execution.mojo",
      "parameters": {
        "profile": "full",
        "requested_runs": 3,
        "warmup_runs": 0
      },
      "runs": [
        {
          "run": 1,
          "status": 0,
          "wall_seconds": 3.99,
          "metric_lines": [
            "Moxi localized benchmark passes:  1000",
            "Moxi localized benchmark count:  1000",
            "Moxi localized benchmark initial builds:  1",
            "Moxi localized benchmark final builds:  1001",
            "Moxi localized benchmark invalidations:  1000",
            "Moxi localized benchmark dependency visits:  1000",
            "Moxi localized benchmark dirty consumed:  1000",
            "Moxi localized benchmark reconciled nodes:  3003",
            "Moxi localized benchmark paint commands:  6006",
            "Moxi localized benchmark total work:  14010",
            "Moxi localized matrix children/passes:  1 / 1000",
            "Moxi localized matrix initial builds:  1",
            "Moxi localized matrix final builds:  1001",
            "Moxi localized matrix invalidations:  1000",
            "Moxi localized matrix dependency visits:  1000",
            "Moxi localized matrix reconciled nodes:  1001",
            "Moxi localized matrix paint commands:  2002",
            "Moxi localized matrix total work:  8004",
            "Moxi localized matrix children/passes:  10 / 1000",
            "Moxi localized matrix initial builds:  1",
            "Moxi localized matrix final builds:  1001",
            "Moxi localized matrix invalidations:  1000",
            "Moxi localized matrix dependency visits:  1000",
            "Moxi localized matrix reconciled nodes:  10010",
            "Moxi localized matrix paint commands:  11011",
            "Moxi localized matrix total work:  26022",
            "Moxi localized matrix children/passes:  100 / 1000",
            "Moxi localized matrix initial builds:  1",
            "Moxi localized matrix final builds:  1001",
            "Moxi localized matrix invalidations:  1000",
            "Moxi localized matrix dependency visits:  1000",
            "Moxi localized matrix reconciled nodes:  100100",
            "Moxi localized matrix paint commands:  101101",
            "Moxi localized matrix total work:  206202"
          ]
        },
        {
          "run": 2,
          "status": 0,
          "wall_seconds": 1.49,
          "metric_lines": [
            "Moxi localized benchmark passes:  1000",
            "Moxi localized benchmark count:  1000",
            "Moxi localized benchmark initial builds:  1",
            "Moxi localized benchmark final builds:  1001",
            "Moxi localized benchmark invalidations:  1000",
            "Moxi localized benchmark dependency visits:  1000",
            "Moxi localized benchmark dirty consumed:  1000",
            "Moxi localized benchmark reconciled nodes:  3003",
            "Moxi localized benchmark paint commands:  6006",
            "Moxi localized benchmark total work:  14010",
            "Moxi localized matrix children/passes:  1 / 1000",
            "Moxi localized matrix initial builds:  1",
            "Moxi localized matrix final builds:  1001",
            "Moxi localized matrix invalidations:  1000",
            "Moxi localized matrix dependency visits:  1000",
            "Moxi localized matrix reconciled nodes:  1001",
            "Moxi localized matrix paint commands:  2002",
            "Moxi localized matrix total work:  8004",
            "Moxi localized matrix children/passes:  10 / 1000",
            "Moxi localized matrix initial builds:  1",
            "Moxi localized matrix final builds:  1001",
            "Moxi localized matrix invalidations:  1000",
            "Moxi localized matrix dependency visits:  1000",
            "Moxi localized matrix reconciled nodes:  10010",
            "Moxi localized matrix paint commands:  11011",
            "Moxi localized matrix total work:  26022",
            "Moxi localized matrix children/passes:  100 / 1000",
            "Moxi localized matrix initial builds:  1",
            "Moxi localized matrix final builds:  1001",
            "Moxi localized matrix invalidations:  1000",
            "Moxi localized matrix dependency visits:  1000",
            "Moxi localized matrix reconciled nodes:  100100",
            "Moxi localized matrix paint commands:  101101",
            "Moxi localized matrix total work:  206202"
          ]
        },
        {
          "run": 3,
          "status": 0,
          "wall_seconds": 1.46,
          "metric_lines": [
            "Moxi localized benchmark passes:  1000",
            "Moxi localized benchmark count:  1000",
            "Moxi localized benchmark initial builds:  1",
            "Moxi localized benchmark final builds:  1001",
            "Moxi localized benchmark invalidations:  1000",
            "Moxi localized benchmark dependency visits:  1000",
            "Moxi localized benchmark dirty consumed:  1000",
            "Moxi localized benchmark reconciled nodes:  3003",
            "Moxi localized benchmark paint commands:  6006",
            "Moxi localized benchmark total work:  14010",
            "Moxi localized matrix children/passes:  1 / 1000",
            "Moxi localized matrix initial builds:  1",
            "Moxi localized matrix final builds:  1001",
            "Moxi localized matrix invalidations:  1000",
            "Moxi localized matrix dependency visits:  1000",
            "Moxi localized matrix reconciled nodes:  1001",
            "Moxi localized matrix paint commands:  2002",
            "Moxi localized matrix total work:  8004",
            "Moxi localized matrix children/passes:  10 / 1000",
            "Moxi localized matrix initial builds:  1",
            "Moxi localized matrix final builds:  1001",
            "Moxi localized matrix invalidations:  1000",
            "Moxi localized matrix dependency visits:  1000",
            "Moxi localized matrix reconciled nodes:  10010",
            "Moxi localized matrix paint commands:  11011",
            "Moxi localized matrix total work:  26022",
            "Moxi localized matrix children/passes:  100 / 1000",
            "Moxi localized matrix initial builds:  1",
            "Moxi localized matrix final builds:  1001",
            "Moxi localized matrix invalidations:  1000",
            "Moxi localized matrix dependency visits:  1000",
            "Moxi localized matrix reconciled nodes:  100100",
            "Moxi localized matrix paint commands:  101101",
            "Moxi localized matrix total work:  206202"
          ]
        }
      ]
    },
    {
      "name": "retained layout/paint/scene",
      "command": "pixi run mojo run -I src benchmarks/layout.mojo",
      "parameters": {
        "profile": "full",
        "requested_runs": 3,
        "warmup_runs": 0
      },
      "runs": [
        {
          "run": 1,
          "status": 0,
          "wall_seconds": 6.88,
          "metric_lines": [
            "Moxi retained pipeline benchmark passes:  100",
            "Moxi paint benchmark commands:  42",
            "Moxi scene benchmark checksum:  334525300",
            "Moxi virtual benchmark visible:  48 .. 69",
            "Moxi variable virtual benchmark visible:  107 .. 130",
            "Moxi variable virtual retained slots:  24",
            "Moxi benchmark average operations/frame:  176.0",
            "Moxi benchmark rasterized pixels/frame:  179558"
          ]
        },
        {
          "run": 2,
          "status": 0,
          "wall_seconds": 2.02,
          "metric_lines": [
            "Moxi retained pipeline benchmark passes:  100",
            "Moxi paint benchmark commands:  42",
            "Moxi scene benchmark checksum:  334525300",
            "Moxi virtual benchmark visible:  48 .. 69",
            "Moxi variable virtual benchmark visible:  107 .. 130",
            "Moxi variable virtual retained slots:  24",
            "Moxi benchmark average operations/frame:  176.0",
            "Moxi benchmark rasterized pixels/frame:  179558"
          ]
        },
        {
          "run": 3,
          "status": 0,
          "wall_seconds": 1.95,
          "metric_lines": [
            "Moxi retained pipeline benchmark passes:  100",
            "Moxi paint benchmark commands:  42",
            "Moxi scene benchmark checksum:  334525300",
            "Moxi virtual benchmark visible:  48 .. 69",
            "Moxi variable virtual benchmark visible:  107 .. 130",
            "Moxi variable virtual retained slots:  24",
            "Moxi benchmark average operations/frame:  176.0",
            "Moxi benchmark rasterized pixels/frame:  179558"
          ]
        }
      ]
    },
    {
      "name": "portable plot scene",
      "command": "pixi run mojo run -I src benchmarks/plotting.mojo",
      "parameters": {
        "profile": "full",
        "requested_runs": 3,
        "warmup_runs": 0
      },
      "runs": [
        {
          "run": 1,
          "status": 0,
          "wall_seconds": 5.67,
          "metric_lines": [
            "Moxi plot benchmark passes:  100",
            "Moxi plot benchmark commands/frame:  65",
            "Moxi plot benchmark rasterized pixels/frame:  276317",
            "Moxi plot benchmark checksum:  852464264"
          ]
        },
        {
          "run": 2,
          "status": 0,
          "wall_seconds": 1.27,
          "metric_lines": [
            "Moxi plot benchmark passes:  100",
            "Moxi plot benchmark commands/frame:  65",